Museum Name,City,Address,Opening Hours,Entry Fee,Phone Number,Email,Website,Latitude,Longitude,Type of Museum,Year Established,Popular Exhibits,Nearest Landmark
Government Museum,Chennai,"Pantheon Rd, Egmore, Chennai, Tamil Nadu 600008",9:30 AM - 5:00 PM,"₹15 (Indian), ₹250 (Foreigner)",044-28193238,gmc@tn.gov.in,https://www.governmentmuseumchennai.com/,13.0735,80.2605,"History, Archaeology",1851,"Bronze Gallery, Amaravati Art",Near Egmore Railway Station
DakshinaChitra,Chennai,"East Coast Road, Muttukadu, Tamil Nadu 603104",10:00 AM - 6:00 PM,₹100,044-27472603,info@dakshinachitra.net,https://www.dakshinachitra.net/,12.7957,80.2498,"Cultural, Heritage",1996,South Indian Heritage Village,Near Muttukadu Lake
Gandhi Memorial Museum,Madurai,"Tamukkam Rd, Madurai, Tamil Nadu 625020","10:00 AM - 1:00 PM, 2:00 PM - 5:45 PM",Free,0452-2531060,gmm@tn.gov.in,https://gandhimuseum.org/,9.9296,78.1217,History,1959,Mahatma Gandhi Artifacts,Near Tamukkam Grounds
Fort St. George Museum,Chennai,"Rajaji Salai, Chennai, Tamil Nadu 600009",9:00 AM - 5:00 PM,₹5,044-25671127,fortmuseum@tn.gov.in,https://www.tnmuseum.com/fort-st-george-museum,13.0809,80.2891,"History, Colonial Era",1948,Colonial Era Artifacts,Near Fort St. George
Chennai Rail Museum,Chennai,"2A, ICF Colony, Ayanavaram, Chennai, Tamil Nadu 600038",10:00 AM - 5:00 PM,₹40,044-26144249,crm@tn.gov.in,https://www.chennairailmuseum.in/,13.1041,80.2197,Railways,2002,"Vintage Locomotives, Heritage Trains",Near Integral Coach Factory
"Government Museum, Pudukkottai",Pudukkottai,"Thirukokarnam, Pudukkottai, Tamil Nadu 622001",9:00 AM - 5:00 PM,₹5,04322-222220,pdkmuseum@tn.gov.in,https://www.tnmuseum.com/pudukottai-museum,10.3797,78.8206,"History, Archaeology",1910,Artifacts from Early Historic Period,Near Thirukokarnam Temple
